ⲉ ⲩⲅⲛⲱⲥⲧⲟⲥ ⲡ ⲙⲁⲕⲁⲣⲓⲟⲥ ⲛ ⲛⲉ ⲧⲉ ⲛ ⲟⲩ ϥ ⲛⲉ ϫⲉ ⲣⲁϣⲉ ϩⲛ ⲛⲉ ⲉⲓ	
7505191	ⲉ ⲧⲣⲉⲧⲛ ⲉⲓⲙⲉ ϫⲉ ⲣⲱⲙⲉ ⲛⲓⲙ ⲛⲧ ⲁ ⲩ ϫⲡⲟ ⲟⲩ ϫⲛ ⲛ ⲧ ⲕⲁⲧⲁⲃⲟⲗⲏ ⲙ ⲡ ⲕⲟⲥⲙⲟⲥ ϣⲁ ⲧⲉⲛⲟⲩ ⲥⲉ ⲟ ⲛϣϩⲓϭ ⲉ ⲩ ϣⲓⲛⲉ ⲛ ⲥⲁ ⲡ ⲛⲟⲩ ⲧⲉ ϫⲉ ⲛⲓⲙ ⲡⲉ ⲏ ⲟⲩⲉϣ ⲛ ϩⲉ ⲡⲉ ⲙⲡ ⲟⲩ ϩⲉ ⲉⲣⲟ ϥ ⲛ ⲥⲁⲃⲉⲉⲩⲉ ⲉ ⲧ ⲛ ϩⲏⲧ ⲟⲩ ⲛ ϩⲟⲩⲟ ⲉⲃⲟⲗ ϩⲛ ⲧⲇⲓⲟⲓⲕⲏ ⲥⲓ ⲥ ⲙ ⲡ ⲕⲟⲥⲙⲟⲥ ⲁ ⲩ ϯ ⲧⲁ ⲛⲧⲛ ⲉⲧⲙⲏⲉ ⲁⲩⲱ ⲙⲡⲉⲡⲧⲁⲛⲧⲛ ⲧⲁ ϩⲉ ⲧⲙⲏⲉ ⲧ ⲇⲓⲟⲓⲕⲏⲥⲓⲥ ⲛ ⲅⲁⲣ ϣⲁ ⲩ ϣⲁϫⲉ ⲉⲣⲟ ⲥ ⲛ ϣⲟⲙⲧⲉ ⲛ ϭⲓⲛ ϣⲁϫⲉ ⲉⲃⲟⲗ ϩⲓⲧⲟⲟⲧ ⲟⲩ ⲛ ⲛⲉ ⲫⲓⲗⲟⲥⲟⲫⲟⲥ ⲧⲏⲣ ⲟⲩ ⲉⲧⲃⲉ ⲡⲁⲓ ⲛ ⲥⲉ ⲥⲩⲙⲫⲱⲛⲉⲓ ⲁⲛ ϩⲟ ⲉⲓ ⲛⲉ ⲛ ⲅⲁⲣ ⲛϩⲏⲧ ⲟⲩ ⲥⲉ ϫⲱ ⲙⲙⲟ ⲥ ⲉ ⲡ ⲕⲟⲥⲙⲟⲥ ϫⲉ ⲛⲧⲁⲩⲁⲅⲉ ⲙⲙⲟ ϥ ϩⲓⲧⲟⲟⲧ ϥ ⲙⲙⲓⲛ ⲙⲙⲟϥ	
7505192	ϩⲉⲛ ⲕⲟⲟⲩⲉ ϫⲉ ⲟⲩ ⲡⲣⲟⲛⲟⲓⲁ ⲧⲉ	
7505193	ϩⲉⲛ ⲕⲟⲟⲩⲉ ϫⲉ ⲟⲩⲡ ⲉⲧ ⲏⲡ ⲉϣⲱⲡⲉ ⲡⲉ ⲁⲩⲱ ⲟⲩⲟⲛ ⲛ ⲛⲁⲓ ⲁⲛ ⲛⲉ ⲧ ϣⲟⲙⲧⲉ ϭⲉ ⲛ ⲥⲙⲏ ⲛⲧⲁⲉⲓⲣ ϣⲣⲡ ⲛ ϫⲟⲟ ⲩ ⲙⲛ ⲟⲩⲉⲓ ⲙⲙⲟ ⲟⲩ ⲏⲡ ⲉⲧ ⲙⲏⲉ	
7505194	ⲡ ⲉⲧⲉⲃⲟⲗ ⲅⲁⲣ ϩⲓ ⲧⲟ ⲟⲧ ϥ ⲙⲙⲓⲛ ⲙⲙⲟ ϥ ⲟⲩ ⲃⲓⲟⲥ ⲉϥ ϣⲟⲩⲉⲓⲧ ⲡⲉ ϣⲁ ϥ ⲁⲁ ϥ ⲧⲉ ⲡ ⲣⲟ ⲛⲟⲓⲁ ⲟⲩ ⲙⲛⲧ ⲥⲟϭ ⲧⲉ ⲧ ⲉⲧ ϩⲁⲛⲧ ⲟⲩⲉⲓ ⲉ ⲙⲉⲥⲉⲥⲑⲁⲛ ⲉⲧⲉ	
7505195	ⲡ ⲉⲧⲉ ⲟⲩⲛ ϣ ϭⲟⲙ ϭⲉ ⲙⲙⲟ ϥ ⲉ ⲉⲓ ⲉϩⲟⲩⲛ ⲙⲡ ⲃⲟⲗ ⲛⲧⲉⲉⲓ ϣⲟⲙⲧⲉ ⲛ ⲥⲙⲏ ⲛ ⲧⲁ ⲉ ⲓ ϣⲣⲡ ⲛ ϫⲟⲟ ⲩ ⲛ ϥ ⲉⲓ ⲉϩⲟⲩⲛ ϩⲓ ⲧⲛ ⲕⲉ ⲥⲙⲏ ⲛ ϥ ⲟⲩⲱⲛϩ ⲉⲃⲟⲗ ⲙⲡ ⲛⲟⲩⲧⲉ ⲛ ⲧ ⲁⲗⲏⲑⲉⲓⲁ ⲛϥⲥⲩⲙⲫⲱ ⲛⲓ ⲛ ⲟⲩⲟⲛ ⲛⲓⲙ ⲉ ⲧⲃⲏⲧ ϥ ⲡⲁⲓ ⲟⲩ ⲁⲑⲁⲛⲁⲧⲟⲥ ⲡⲉ ⲉ ϥ ϣⲟⲟⲡ ϩⲛ ⲧ ⲙⲏ ⲧⲉ ⲛ ⲛ ⲣⲱⲙⲉ ⲉ ϣⲁ ⲩ ⲙⲟⲩ ⲡⲉⲧ ϣⲟⲟⲡ ⲟⲩ ⲁⲧϣⲁϫⲉ ⲉⲣⲟ ϥ ⲡⲉ	
7505196	ⲙ ⲡⲉ ⲁⲣⲭⲏ ⲥⲟⲩⲱⲛ ϥ ⲙⲡⲉ ⲉⲯⲟⲩ ⲥ ⲓⲁ ⲙⲡⲉ ϩⲩⲡⲟⲧⲁⲅⲏ ⲙ ⲡⲉ ⲫⲩⲥⲓⲥ ⲛⲓⲙ ϫⲛ ⲛ ⲧ ⲕⲁⲧⲁⲃⲟⲗⲏ ⲙ ⲡ ⲕⲟⲥⲙⲟⲥ ⲉⲓⲙⲏⲧⲓ ⲛⲧⲟϥ ⲟⲩⲁⲁϥ	
7505197	ⲡ ⲉⲧ ⲙⲙⲁⲩ ⲅⲁⲣ ⲟⲩ ⲁⲑⲁⲛⲁⲧⲟⲥ ⲡⲉ ⲟⲩ ϣⲁ ⲁ ⲛ ⲏ ϩⲉ ⲡⲉ ⲉ ⲙⲛⲧ ⲉ ϥ ϫⲡⲟ ⲟⲩⲟⲛ ⲅⲁⲣ ⲛⲓⲙ ⲉⲧⲉ ⲟⲩⲛⲧⲁ ϥ ϫⲡⲟ ϥ ⲛⲁ ⲧⲁⲕⲟ ⲟⲩ ⲁⲅⲉⲛⲛⲏⲧⲟⲥ ⲡⲉ ⲉ ⲙⲛⲧ ϥ ⲁⲣⲭⲏ ⲟⲩⲁ ⲛ ⲅⲁⲣ ⲛⲓⲙ ⲉⲧⲉ ⲟⲩⲛⲧⲁ ϥ ⲁⲣⲭⲏ ⲟⲩⲛⲧⲁ ϥ ϩⲁⲏ	
7505198	ⲙⲙⲛ ⲗⲁⲁⲩ ⲁⲣⲭⲓ ⲉ ϫⲱ ϥ ⲙⲙⲛⲧⲁ ϥ ⲣⲁⲛ ⲡ ⲉ ⲧⲉ ⲟⲩⲛ ⲧ ϥ ⲣⲁⲛ ⲅⲁⲣ ⲡ ⲥⲱⲛⲧ ⲛ ⲕⲉ ⲟⲩⲁ ⲡⲉ ⲟⲩ ⲁⲧϯ ⲣⲁⲛ ⲉⲣⲟ ϥ ⲡⲉ ⲙⲛ ⲧⲁϥ ⲙⲟⲣⲫⲏ ⲛ ⲣⲱⲙⲉ ⲡ ⲉ ⲧⲉ ⲟⲩⲛⲧ ϥ ⲙⲟⲣⲫⲏ ⲅⲁⲣ ⲛ ⲣⲱⲙⲉ ⲡ ⲥⲱⲛⲧ ⲛ ⲕⲉ ⲟⲩⲁ ⲡⲉ ⲟⲩⲛⲧⲁ ϥ	
7505199	ⲛⲛⲟⲩϩⲓ ⲇⲉ ⲁ ⲙⲙⲓⲛ ⲙⲙⲟ ϥ ⲛ ⲑ ⲉ ⲁⲛ ⲛ ⲧϩⲓⲇⲉⲁ ⲛⲧ ⲁ ⲛ ϫⲓⲧ ⲥ ⲏ ⲛ ⲧⲁ ⲛ ⲛⲁⲩ ⲉⲣⲟ ⲥ ⲁⲗⲗⲁ ⲟⲩϩⲓⲇⲉⲁ ⲛϣⲙⲙⲱ ⲧⲉ ⲉ ⲥⲟⲩⲁⲧⲃ ⲛ ϩⲟⲩⲟ ⲉ ⲛⲕⲁ ⲛⲓⲙ ⲉ ⲥⲥⲁⲧⲡ ⲉ ⲛⲓⲡⲧⲏⲣϥ	
7505200	ⲉⲥⲛⲁⲩ ϩⲓ ⲥⲁ ⲛⲓⲙ ⲉ ⲥ ⲉⲓⲱⲣϩ ⲙⲙⲟ ⲥ ⲟⲩⲁⲁ ⲥ ϩⲓ ⲧⲟⲟⲧ ⲥ ⲙⲙⲓⲛ ⲙⲙⲟ ⲥ ⲟⲩⲁⲧⲁⲣⲏϫ ϥ ⲡⲉ ⲟⲩⲁⲧ ⲧⲁϩⲟ ϥ ⲡⲉ ⲟⲩⲁ ⲉ ϥ ⲙⲏⲛ ⲉⲃⲟⲗ ⲡⲉ ⲛⲁⲫⲑⲁⲣ ⲧⲟⲥ	
7505201	ⲟⲩⲁ ⲉ ⲙⲛ ⲧⲁϥ ⲡⲉϥ ⲉⲓⲛⲉ ⲡⲉ ⲟⲩ ⲁⲅⲁⲑⲟⲥ ⲡⲉ ⲛ ⲁⲧϣⲓⲃⲉ ⲟⲩ ⲁⲧ ϣⲱⲱⲧ ⲡⲉ ⲟⲩⲁ ⲉ ϥ ⲙⲏⲛ ⲉⲃⲟⲗ ⲡⲉ ⲟⲩ ⲙⲁⲕⲁⲣⲓⲟⲥ ⲡⲉ ⲟⲩⲁⲧⲛⲟ ⲉⲓ ⲙⲙⲟ ϥ ⲡⲉ ⲉ ϣⲁ ϥ ⲛⲟⲉⲓ ⲙ ⲙⲟϥ ⲙⲙⲓⲛ ⲙⲙⲟϥ	
7505202	ⲟⲩⲁⲧ ϣⲓ ⲧ ϥ ⲡⲉ ⲟⲩ ⲁⲧϫⲓ ϭⲉϫⲙ ⲛⲥⲱ ϥ ⲡⲉ ⲟⲩ ⲧⲉⲗⲉⲓⲟⲥ ⲡⲉ ⲉ ⲙⲛⲧ ⲉ ϥ ϣⲱ ⲱ ⲧ ⲟⲩ ⲙⲁⲕⲁⲣⲓⲟⲥ ⲡⲉ ⲛⲁⲫⲑⲁⲣ ⲧⲟ ⲥ ϣⲁⲩⲭⲟⲟⲥ ⲉⲣⲟ ϥ ϫⲉ ⲡ ⲓⲱⲧ ⲙⲡ ⲧⲏⲣ ϥ	
7505203	ϩⲁⲑⲏ ⲉ ⲙⲡⲁⲧⲉ ⲗⲁⲁⲩ ⲟⲩⲱⲛϩ ϩⲛ ⲛ ⲉⲧ ⲟⲩⲁⲛϩ ⲉ ⲃⲟⲗ	
7505204	ϯ ⲙⲛⲧ ⲛⲟϭ ⲙⲛ ⲛⲓⲉⲯⲟⲩⲥⲓⲁ ⲉ ⲧϣⲟⲟⲡ ⲛϩⲏⲧ ϥ ⲉ ϥ ⲁⲙⲁϩⲧⲉ ⲛ ⲛⲓ ⲡⲧⲏⲣϥ	
7505205	ⲛⲧⲉ ⲛⲓⲡⲧⲏⲣϥ	
7505206	ⲁⲩⲱ ⲙ ⲙⲛ ⲗⲁⲁⲩ ⲁⲙⲁϩⲧⲉ ⲙⲙⲟϥ	
7505207	ⲡⲉⲧⲙ ⲙⲁ ⲩ ⲅⲁⲣ	
7505208	ⲟⲩⲛⲟⲩ ⲥ ⲧⲏⲣ ϥ	
7505209	ⲟⲩ ⲉⲛⲛⲟⲓⲁ ⲙⲛ ⲟⲩ ⲉⲛⲑⲩⲙⲏⲥⲓⲥ ⲟⲩ ⲫⲣⲟⲛⲏⲥⲓⲥ ⲟⲩ ⲗⲟⲅⲓⲥⲙⲟⲥ ⲙⲛ ⲟⲩ ⲇⲩⲛⲁⲙⲓⲥ ⲛⲧⲟⲟⲩ ⲧⲏⲣ ⲟⲩ ϩⲉⲛ ϩⲓⲥⲟⲇⲩⲛⲁ ⲙⲓⲥ ⲛⲉ ⲙ ⲡⲏⲅⲏ ⲛⲛⲓⲡ ⲧⲏⲣ ϥ ⲛⲉ ⲁⲩⲱ ⲡⲉⲩ ⲅⲉⲛⲟⲥ ⲧⲏⲣ ϥ ϫⲓⲛ ⲛ ϣⲟⲣⲡ ϣⲁ ⲁ ⲣⲏ ϫⲛ ⲟⲩ ⲉ ⲩ ϣⲟⲟⲡ ϩⲙ ⲡⲉϩⲟⲩⲉⲓⲧ ⲛ ⲥⲟⲟⲩⲛ ⲙⲡⲁⲅⲉⲛⲛⲏⲧⲟⲥ	
7505210	ⲛⲉ ⲙ ⲡⲁ ⲧ ⲟⲩⲉⲓ ⲅⲁⲣ ⲉ ⲡ ⲉⲧ ⲟⲩⲁⲛϩ ⲛⲉ ⲟⲩ ⲛ ⲟⲩ ⲇⲓⲁⲫⲟⲣⲁ ⲇⲉ ϣⲟⲟⲡ	
7505211	ⲟⲩⲧⲉ ⲛⲓ ⲁⲫⲑⲁⲣⲧⲟⲥ ⲛ ⲁⲓⲱⲛ ⲙⲁⲣⲉ ⲛ ⲛⲟⲉⲓ ϭⲉ ⲛⲧⲉⲉⲓϩⲉ ϫⲉ ⲛ ⲕⲁ ⲛⲓⲙ ⲛⲧ ⲁ ⲩ ϣⲱⲡⲉ ⲉⲃⲟⲗ ϩⲙ ⲡ ⲧⲁⲕⲟ ⲥⲉ ⲛⲁ ⲧⲁⲕⲟ ϩⲱⲥ ⲉ ⲁ ⲩ ϣⲱ ⲡⲉ ⲉⲃⲟⲗ ϩⲙ ⲡⲧⲁⲕⲟ	
7505212	ⲡⲉⲛⲧⲁ ϥ ϣⲱ ⲡⲉ ⲉⲃⲟⲗ ϩⲛ ⲧ ⲁⲫⲑⲁⲣⲥⲓⲁ ⲛ ϥ ⲛⲁ ⲧⲁⲕⲟ ⲁⲛ ⲁⲗⲗⲁ ⲉ ϥ ⲛⲁ ϣⲱⲡⲉ ⲛ ⲁⲫⲑⲁⲣⲧⲟⲥ ϩⲱⲥ ⲉ ⲁ ϥ ϣⲱⲡⲉ ⲉ ⲃⲟⲗ ϩⲛ ⲧⲁⲫⲑⲁⲣⲥⲓⲁ	
7505213	ϩⲱⲥⲧⲉ ⲟⲩ ⲙⲏⲏϣⲉ ⲛ ⲣⲱⲙⲉ ⲁ ⲩ ⲡⲗⲁⲛⲁ ⲙⲡ ⲟⲩ ⲥⲟⲩⲛ ⲧⲉⲉⲓ ⲇⲓⲁⲫⲟⲣⲁ ⲉⲧⲉ ⲧⲁⲓ ⲧⲉ ⲁ ⲩⲙⲟⲩ	
7505214	ⲁⲩⲱ ϩⲱ ϣⲁ ⲡⲉⲉⲓⲙⲁ	
7505215	ⲉⲡⲓ ⲙⲛ ϣ ϭⲟⲙ ⲛ ⲗⲁⲁⲩ ⲉ ϯ ⲟⲩⲃⲉ ⲧⲉ ⲫⲩⲥⲓⲥ ⲛ ⲛ ϣⲁϫⲉ ⲛⲧⲁⲉⲓⲣ ϣⲣⲡ ⲛϫⲟⲟⲩⲉ ⲙ ⲡ ⲙⲁ ⲕⲁⲣⲓⲟⲥ ⲛ ⲁⲫⲑⲁⲣⲧⲟⲥ ⲛ ⲛⲟⲩⲧⲉ ⲙⲙⲏⲉ	
7505216	ⲉϣⲱⲡⲉ ϭⲉ ⲉ ⲩ ⲛ ⲟⲩⲁ ⲉ ϥ ⲟⲩⲉϣ ⲡⲓⲥⲧⲉⲩⲉ ⲉ ⲛ ϣⲁϫⲉ ⲉⲧ ⲕⲏ ⲉϩⲣⲁⲓ ⲙⲁⲣⲉ ϥ ⲙⲟⲩϣⲧ ϫⲛ ⲙ ⲡ ⲉⲑ ⲏⲡ ϣⲁ ⲡ ϫⲱⲕ ⲙ ⲡⲉ ⲧⲟⲩⲁⲛϩ ⲉⲃⲟⲗ ⲁⲩⲱ ⲧⲉⲉⲓⲉⲛ ⲛⲟⲓ ⲁ	
7505217	ⲛⲁⲧⲥⲁⲃⲟ ϥ ϫⲉ ⲡⲱⲥ ⲧ ⲡⲓⲥⲧⲓⲥ ⲛ ⲛ ⲉ ⲧⲉ ⲛ ⲥⲉ ⲟⲩⲟⲛϩ ⲉⲃⲟⲗ ⲁⲛ	
7505218	ⲁⲩ ϭⲛⲧ ⲥ ϩⲙ ⲡ ⲉⲧ ⲟⲩⲁⲛϩ ⲉ ⲃⲟⲗ	
7505219	ⲟⲩ ⲁⲣⲭⲏ ⲛ ⲥⲟⲟⲩⲛ ⲧⲉ ⲧⲁⲓ	
7505220	ⲡ ϫⲟⲉⲓⲥ ⲙ ⲡ ⲧⲏⲣ ϥ ⲕⲁⲧⲁ ⲧ ⲁⲗⲏⲑⲉⲓⲁ ⲙⲉ ⲩ ϫⲟⲟ ⲥ ⲉⲣⲟ ϥ ϫⲉ ⲉⲓⲱⲧ ⲁⲗⲗⲁ ⲡ ⲣⲟ ⲡⲁⲧⲱⲣ ⲡ ⲉⲓⲱⲧ ⲅⲁⲣ ⲧ ⲁⲣⲭⲏ ⲙ ⲡ ⲉⲧ ⲟⲩⲁⲛϩ ⲉⲃⲟⲗ ⲡⲉ	
7505221	ⲡ ⲉⲧⲙ ⲙⲁ ⲩ ⲅⲁⲣ ⲡ ⲁⲛⲁⲣⲭⲟⲥ ⲙ ⲡ ⲣⲟ ⲡⲁⲧⲱⲣ ⲉ ϥ ⲛⲁⲩ ⲉⲣⲟ ϥ ⲙⲙⲓⲛ ⲙⲙⲟ ϥ ⲛϩⲣⲁⲓ ⲛϩⲏⲧϥ	
7505222	ⲛⲑⲉ ⲛ ⲟⲩ ⲉⲓⲁⲗ	
7505223	ⲉⲁ ϥ ⲟⲩⲱⲛϩ ⲉⲃⲟⲗ ϩⲙ ⲡⲉϥ ⲉⲓⲛⲉ ⲛ ⲁⲩⲧⲟⲡⲁⲧⲱⲣ ⲉⲧⲉ ⲡⲁⲓ ⲡⲉ ⲡⲁⲩⲧⲟⲅⲉⲛ ⲉⲧⲱⲣ	
7505224	ⲁⲩⲱ ⲛⲁ ⲛ ⲧⲟⲡⲟⲥ ⲉⲡ ⲓ ⲁⲛⲧⲟⲡⲓⲧⲱ ⲙ ⲡ ⲣⲟ ⲟⲛⲧⲟⲥ ⲛⲁⲅⲉⲛⲛⲏⲧⲟⲥ	
7505225	ⲟⲩϩⲓ ⲥⲟⲭⲣⲟⲛⲟⲥ ⲙⲉⲛ ⲡⲉ ⲙⲡⲉⲧ ϩⲁ ⲧⲉϥ ϩⲏ	
7505226	ⲁⲗⲗⲁ ⲛ ϥ ϣⲏϣ ⲟⲩⲃⲏ ϥ ⲁⲛ ϩⲛ ⲧϭⲟⲙ	
7505227	ⲙⲛⲛⲥⲱϥ ⲁϥ ⲟⲩ ⲱⲛϩ ⲉⲃⲟⲗ ⲛ ⲟⲩ ⲙⲏⲏϣⲉ ⲛⲁ ⲛ ⲧⲟⲡⲟⲥ ⲛ ⲁⲩⲧⲟⲅⲉⲛⲏⲥ ⲛϩⲓⲥⲟ ⲭⲣⲟⲛⲟⲥ ⲛϩⲓⲥⲟⲇⲩⲛⲁⲙⲓⲥ ⲉ ⲩ ϩⲁ ⲉ ⲟⲟⲩ ⲉ ⲙⲛⲧ ⲟⲩ ⲏⲡⲉ	
7505228	ⲉϣⲁⲩ ⲙⲟⲩⲧⲉ ⲉⲣⲟ ⲟⲩ ϫⲉ ⲧ ⲅⲉⲛⲉⲁ ⲉ ⲧⲉ ⲙⲛ ⲙⲛ ⲧ ⲣⲣⲟ ϩⲓϫⲱ ⲥ ⲛϩⲣⲁⲓ ϩⲛ ⲙⲙⲛⲧⲣⲣⲁⲓ ⲉⲧ ⲕⲏ ⲉϩⲣⲁⲓ ⲡ ⲙⲏ ⲏ ϣⲉ ⲇⲉ ⲧⲏⲣ ϥ ⲙ ⲡ ⲙⲁ ⲉⲧⲉ ⲙⲛ ⲙⲛ ⲧ ⲣⲣⲟ ϩⲓϫⲱ ϥ ϣⲁ ⲩ ϫⲟⲟ ⲥ ⲉ ⲣ ⲟ ⲟⲩ ϫⲉ ⲛ ϣⲏⲣⲉ ⲛⲡⲁⲅⲉⲛ ⲛⲏ ⲧⲟ ⲥ ⲛ ⲉⲓⲱⲧ ⲛⲧⲟϥ ⲇⲉ ⲡⲓ ⲁⲧⲛⲟⲉⲓ ⲙⲙⲟ ϥ ⲉ ϥ ⲙⲏϩ ⲉⲃⲟⲗ ⲛ ⲛⲁⲩ ⲛⲓⲙ ⲛ ⲁⲫⲑⲁⲣⲥⲓⲁ ⲙⲛ ⲟⲩ ⲣⲁϣⲉ ⲛⲁ ⲧ ϣⲁ ϫⲉ ⲉⲣⲟ ϥ ⲛⲧⲟⲟⲩ ⲧⲏⲣ ⲟⲩ ⲉ ⲩ ⲙⲧⲟⲛ ⲙⲙⲟ ⲟⲩ ⲛϩⲏⲧ ϥ	
7505229	ⲉⲩⲙⲏⲛ ⲉⲃⲟⲗ ⲉ ⲩ ⲣⲁϣⲉ ϩⲛ ⲟⲩ ⲣⲁϣⲉ ⲛⲁ ⲧ ⲧ ϣⲁϫⲉ ⲉⲣⲟ ϥ ⲉϩⲣⲁⲓ ⲉϫⲙ ⲡ ⲉⲟⲟⲩ ⲉⲧⲉ ⲙⲉ ϥ ϣⲓⲃⲉ ⲙⲛ ⲡ ⲧⲉⲗⲏⲗ ⲉⲧⲉ ⲙⲉⲩϣⲓⲧϥ	
7505230	ⲡⲁⲓ ⲉⲧⲉ ⲙⲡ ⲟⲩ ⲥⲟⲧⲙⲉϥ ⲉⲛⲉϩ ⲟⲩ ⲇⲉ ⲙⲡ ⲟⲩ ⲛⲟⲉⲓ ⲙⲙⲟ ϥ ϩⲛ ⲛ ⲁⲓⲱⲛ ⲧⲏⲣ ⲟⲩ ⲙⲛ ⲛⲉ ⲩⲕⲟⲥⲙⲟⲥ	
7505231	ⲁⲩⲱ ϩⲱ ϣⲁ ⲡⲉ ⲉⲓⲙⲁ ϫⲉⲕⲁⲁⲥ ⲛ ⲛⲉ ⲛ ⲃⲱⲕ ⲉⲃⲟⲗ ϩⲙ ⲡⲓⲁⲡⲓⲣⲟⲛ	
7505232	ⲕⲉ ⲁⲣⲭⲏ ⲛ ⲥⲟⲟⲩⲛ ⲧⲉ ⲧⲁⲓ	
7505233	ⲉⲃⲟⲗ ϩⲓ ⲧⲟⲟⲧ ϥ ⲙⲡⲁⲩⲧⲟⲅⲉⲛⲛⲏⲧⲟⲥ ⲡⲉϩⲟⲩⲉⲓⲧ ⲛⲧ ⲁ ϥ ⲟⲩⲱⲛϩ ϩⲁ ⲑ ⲏ ⲙⲡⲧⲏⲣϥ	
7505234	ϩⲙ ⲡ ⲁⲡⲉⲣⲁⲛⲧⲟⲛ ⲟⲩⲁⲩⲧⲟⲫⲩ ⲏ ⲥ ⲡⲉ ⲛⲁⲩⲧⲟⲕⲧⲓⲥⲧⲟⲥ ⲛ ⲉⲓⲱⲧ ⲉ ϥ ϫⲏⲕ ⲉⲃⲟⲗ ϩⲙ ⲡ ⲟⲩⲟⲉⲓⲛ ⲉⲧ ⲣ ⲟⲩ ⲟⲉⲓⲛ ⲛⲁ ⲧ ϣⲁϫⲉ ⲉⲣⲟ ϥ ⲡⲁⲓ ⲁ ϥⲛⲟ ⲉⲓ ⲛ ⲧ ⲁⲣⲭⲏ ⲉ ⲧⲣⲉ ⲡⲉϥ ⲉⲓⲛⲉ ϣⲱ ⲡⲉ ⲛ ⲟⲩ ⲛⲟϭ ⲛϭⲟⲙ	
7505235	ⲛ ⲧⲉ ⲩⲛⲟⲩ ⲁ ⲧ ⲁⲣⲭⲏ ⲙ ⲡ ⲟⲩⲟⲉⲓⲛ ⲉⲧ ⲙⲙⲁⲩ ⲟⲩⲱⲛϩ ⲉⲃⲟⲗ ⲛ ⲟⲩ ⲣⲱⲙⲉ ⲛⲁⲑⲁ ⲛⲁⲧⲟⲥ ⲛϩⲟⲟⲩⲧⲥϩⲓⲙⲉ	
7505236	ⲡⲉϥ ⲣⲁⲛ ⲙⲙⲛⲧϩⲟⲟⲩⲧ ϣⲁ ⲩ ϫⲟⲟ ⲥ ⲉⲣⲟ ϥ ϫⲉ ⲡⲉ ϫⲡⲟ ⲡ ⲛⲟⲩⲥ ⲉⲧ ϫⲏⲕ ⲉ ⲃⲟⲗ	
7505237	ⲡⲉϥ ⲣⲁⲛ ⲇⲉ ⲙⲙⲛⲧⲥϩⲓⲙⲉ ⲡⲁ ⲛ ⲥⲟ ⲫⲟⲥ ⲥⲟⲫⲓⲁ ⲛⲅⲉⲛ ⲉⲧⲉⲓⲣⲁ	
7505238	ⲥⲉ ϫⲱ ⲙⲙⲟ ⲥ ⲉⲣⲟ ⲥ ⲟⲛ ϫⲉ ⲉ ⲥ ⲉⲓⲛⲉ ⲙ ⲡⲉ ⲥ ⲥⲟⲛ ⲁⲩⲱ ⲡⲉⲥⲥⲩⲛⲩⲅⲟⲥ	
7505239	ⲟⲩ ⲙⲏ ⲉ ⲉ ⲩ ⲙⲉ ⲩ ϯ ⲛⲙⲙⲁ ⲥ ⲧⲉ	
7505240	ⲧⲙ ⲏ ⲉ ⲅⲁⲣ ⲙⲡⲉⲥⲏⲧ ϣⲁ ⲥ ϯ ⲛⲙⲙⲁ ⲥ ⲛϭⲓ ⲧⲉ ⲡⲗⲁⲛⲏ ⲉⲧ ⲛⲙⲙⲁ ⲥ ⲉⲃⲟⲗ ϩⲓⲧⲟⲟⲧ ϥ ⲙ ⲡ ⲁⲑⲁⲛⲁⲧⲟⲥ ⲛ ⲣⲱⲙⲉ ⲁ ⲥ ⲟⲩⲱⲛϩ ⲉⲃⲟⲗ ⲛϭⲓ ⲟⲩⲟⲛⲟⲙⲁ ⲥ ⲓⲁ ⲛ ϣⲟⲣⲡ ϫⲉ ⲙⲛ ⲧ ⲛⲟⲩⲧⲉ ϩⲓ ⲙⲛⲧ ⲣⲣⲟ	
7505241	ⲡⲓⲱⲧ ⲅⲁⲣ ⲉ ϣⲁ ⲩ ϫⲟⲟ ⲥ ⲉⲣⲟ ϥ ϫⲉ ⲡ ⲣⲱⲙⲉ ⲛⲁ ⲩ ⲧⲟ ⲡⲁⲧⲱⲣ ⲁ ϥ ⲟⲩⲱⲛϩ ⲙⲡⲉ ⲉⲓ ⲉⲃⲟⲗ ⲁ ϥ ⲧⲁⲙⲓⲟ ⲛⲁ ϥ ⲛ ⲟⲩ ⲛⲟϭ ⲛ ⲁⲓⲱⲛ ⲡⲣⲟⲥ ⲧⲉϥ ⲙⲛⲧ ⲛⲟϭ ⲁ ϥ ϯ ⲛⲁ ϥ ⲛ ⲟⲩ ⲛⲟϭ ⲛⲉⲯⲟⲩⲥⲓⲁ	
7505242	ⲁ ϥⲣ ⲣⲣⲟ ⲉϩⲣⲁⲓ ⲉϫⲛ ⲛ ⲥⲱⲛⲧ ⲧⲏⲣ ⲟⲩ ⲁ ϥ ⲥⲱⲛⲧ ⲛⲁ ϥ ⲛ ϩⲉⲛ ⲛⲟⲩⲧⲉ ⲙⲛ ϩⲉⲛⲁⲣⲭⲁⲅ ⲅⲉⲗⲟⲥ ⲙⲛ ϩⲉⲛ ⲁⲅⲅⲉⲗⲟⲥ ϩⲉⲛ ⲧⲃⲁ ⲉ ⲙⲛⲧ ⲟⲩ ⲏⲡⲉ	
7505243	ⲉϩⲟⲩⲛ ⲉ ⲩϩⲩⲡⲏ ⲣⲉⲥⲓⲁ ⲉⲃⲟⲗ ϭⲉ ϩⲓⲧⲟⲟⲧ ϥ ⲙ ⲡ ⲣⲱⲙⲉ ⲉⲧ ⲙⲙⲁⲩ ⲁ ⲥ ⲁⲣⲭⲉⲥⲑⲁⲓ ⲛϭⲓ ⲧ ⲙⲛⲧ ⲛⲟⲩⲧⲉ ⲙⲛ ⲧⲙⲛⲧⲣⲣⲟ	
7505244	ⲉⲧⲃⲉ ⲡⲁⲓ ⲁ ⲩ ϯ ⲣⲛ ϥ ϫⲉ ⲡ ⲛⲟⲩⲧⲉ ⲛⲛ ⲛⲟⲩⲧⲉ	
7505245	ⲡ ⲣⲣⲟ ⲛⲣⲣⲱⲟⲩ	
7505246	ⲡⲉϩⲟⲩⲉⲓⲧ ⲛ ⲣⲱⲙⲉ ⲧ ⲡⲓⲥⲧⲓⲥ ⲡⲉ ⲛ ⲛⲉⲧ ⲛⲁ ϣⲱⲡⲉ	
7505247	ⲙⲛⲛⲥⲁ ⲛⲁⲓ ⲟⲩⲛⲧⲁ ϥ ⲛϩⲏⲧ ϥ ⲛ ⲟⲩ ϩⲓⲇⲓⲟⲛ ⲛ ⲛⲟⲩⲥ ⲟⲩⲉⲛⲛⲟⲓⲁ	
7505248	ⲛ ⲑ ⲉ ⲉⲧⲉ ϥ ⲟ ⲛⲙⲟⲥ ⲟⲩ ⲉⲛⲑⲩⲙⲏⲥⲓⲥ ⲙⲛ ⲟⲩ ⲫⲣⲟⲛⲏⲥⲓⲥ ⲟⲩ ⲗⲟⲅⲓⲥⲙⲟⲥ ⲙⲛ ⲟⲩⲇⲩⲛⲁⲙⲓⲥ	
7505249	ⲙⲉⲗⲟⲥ ⲛⲓⲙ ⲉ ⲧϣⲟⲟⲡ ϩⲛ ⲧⲉⲗⲓⲟⲥ ⲛⲉ ϩⲛⲁⲑⲁⲛⲁ ⲧⲟ ⲥ ⲛⲉ ⲕⲁⲧⲁ ⲙⲉⲛ ⲧ ⲁⲫⲑⲁⲣⲥⲓⲁ ⲥⲉ ϣⲏϣ	
7505250	ⲕⲁⲧⲁ ⲧ ϭⲟⲙ ⲟⲩⲛ ⲟⲩⲇⲓⲁ ⲫⲟⲣⲁ	
7505251	ⲛⲑⲉ ⲛⲡ ϣⲓⲃⲉ ⲛ ⲟⲩ ⲉⲓⲱⲧ ⲉ ⲩϣⲏⲣⲉ	
7505252	ⲁⲩⲱ ⲟⲩ ϣⲏⲣⲉ ⲉ ⲩ ⲉⲛⲛⲟⲓⲁ ⲁⲩⲱ ⲧ ⲉⲛⲛⲟⲓⲁ ⲉ ⲡϣⲱϫⲡ ⲛ ⲑ ⲉ ⲛ ⲧⲁⲉⲓϣⲣⲡ ⲛ ϫⲟⲟ ⲥ ϩⲛ ⲛ ⲉⲛⲧ ⲁ ⲩ ϫⲡⲟ ⲟⲩ	
7505253	ⲧⲙⲟⲛⲁⲥ ⲟ ⲛ ϣⲟⲣⲡ ⲥ ⲟⲩⲏϩ ⲛⲥⲱ ⲥ ⲛϭⲓ ⲧ ⲇⲩⲁⲥ ⲙⲛ ⲧⲉ ⲧⲣⲓⲁⲥ ϣⲁϩⲣⲁⲓ ⲉ ⲛⲣⲁⲙⲏⲧ ⲛⲣⲁⲙⲏⲧ ⲇⲉ ⲥⲉ ⲁⲣⲭⲓ ⲉϫⲛ ⲛⲣⲁϣⲉ	
7505254	ⲉⲣⲉ ⲛ ⲣⲁϣⲉ ⲁⲣⲭⲓ ⲉϫⲛ ⲛⲣⲁϣⲟ	
7505255	ⲉⲣⲉ ⲛ ϣⲟ	
7505256	ⲁⲣ ⲭⲓ ⲉϫⲛ ⲛ ⲉⲧ ⲃⲁ	
7505257	ⲡⲉ ⲥⲙⲟⲧ ⲡⲉ ⲡⲁⲓ ϩⲛ ⲛ ⲁⲑⲁⲛⲁⲧⲟⲥ ⲡⲉϩⲟⲩⲉⲓⲧ ⲛ ⲣⲱ ⲙⲉ ⲛⲧⲉ ⲉⲓϩⲉ	
7505258	ⲧⲉϥ ⲙⲟⲛⲁⲥ ⲧⲉ ⲁ ϥ ⲧⲁⲙⲓⲟ ⲛⲁ ϥ ⲛ ϩⲉⲛ ⲁⲅⲅⲉⲗⲟⲥ ϩⲉⲛ ⲧⲃⲁ ⲉ ⲙⲛⲧ ⲟⲩ ⲏⲡⲉ ⲉϩⲟⲩⲛ ⲉ ⲩϩⲩⲡⲏⲣⲉⲥⲓⲁ	
7505259	ⲡ ⲙⲏⲏϣⲉ ⲧⲏⲣ ϥ ⲛ ⲛ ⲁⲅⲅⲉⲗⲟⲥ ⲉⲧ ⲙⲙⲁⲩ ϣⲁ ⲩ ϫⲟ ⲟ ⲥ ⲉⲣⲟ ⲟⲩ ϫⲉ ⲧ ⲉⲕⲕⲗⲏⲥⲓⲁ ⲛ ⲛⲉ ⲧⲟⲩⲁⲁⲃ	
7505260	ⲛⲟⲩⲟⲉⲓⲛ ⲛⲁ ⲧ ϩⲁⲉⲓⲃⲉⲥ ⲛ ⲉⲧ ⲙⲙⲁⲩ ϭⲉ ⲉ ⲩϣⲁⲛ ⲁⲥⲡⲁⲉ ⲛ ⲛⲉⲩⲉⲣⲏⲟⲩ ϣⲁⲣⲉ ⲛⲉⲩⲁⲥⲡⲁⲥ ⲙⲟⲥ ϣⲱⲡⲉ ⲛ ϩⲉⲛ ⲁⲅⲅⲉⲗⲟⲥ ⲉ ⲩ ⲉⲓⲛⲉ ⲙⲙⲟ ⲟⲩ ⲡⲉⲡⲣⲱⲧⲟⲅⲉⲛⲉ ⲧⲱⲣ	
7505261	ⲛⲉⲓⲱⲧ ϣⲁ ⲩ ϫⲟⲟ ⲥ ⲉⲣⲟ ϥ ϫⲉ ⲁⲇⲁⲙ ⲡⲁ ⲡ ⲟⲩⲟⲉⲓⲛ	
7505262	ⲧⲙⲛⲧ ⲣ ⲣⲟ ⲇⲉ ⲙ ⲡ ϣⲏⲣⲉ ⲙ ⲡ ⲣⲱⲙⲉ ⲉⲥ ⲙⲉϩ ⲛ ⲣⲁϣⲉ ⲛⲁ ⲧ ϣⲁϫⲉ ⲉⲣⲟ ϥ ⲙⲛ ⲟⲩ ⲧⲉⲗⲏⲗ ⲉ ⲙⲉ ϥ ϣⲓⲃⲉ ⲉ ⲩⲧⲉⲣ ⲡⲉ ⲉ ⲩ ⲙⲏⲛ ⲉⲃⲟⲗ ϩⲛ ⲟⲩ ⲣⲁϣⲉ ⲛⲁ ⲧ ϣⲁϫⲉ ⲉⲣⲟ ϥ ⲉϩⲣⲁⲓ ⲉϫⲛ ⲡⲉⲩ ⲉⲟⲟⲩ ⲛⲁⲧⲧⲁⲕⲟ	
7505263	ⲡⲁⲓ ⲉⲧⲉ ⲙ ⲡⲟⲩ ⲥⲟ ⲧⲙⲉ ϥ ⲉⲛⲉϩ ⲟⲩⲇⲉ ⲙ ⲡⲉϥ ⲟⲩⲱⲛϩ ⲉ ⲛ ⲁⲓⲱⲛ ⲧⲏⲣ ⲟⲩ ⲛⲧ ⲁ ⲩ ϣⲱⲡⲉ ⲙⲛ ⲛⲉ ⲩⲕⲟⲥⲙⲟⲥ	
7505264	ⲡ ϣⲏⲣⲉ ϭⲉ ⲙ ⲡ ⲣⲱⲙⲉ ⲁ ϥ ⲥⲩⲙⲫⲱⲛⲉⲓ ⲙⲛ ⲧ ⲥⲟⲫⲓⲁ ⲧⲉϥ ⲥⲩⲛⲩⲅⲟⲥ ⲁϥ ⲟⲩ ⲱⲛϩ ⲉⲃⲟⲗ ⲛ ⲟⲩ ⲛⲟϭ ⲛ ⲟⲩⲟⲉⲓⲛ ⲛϩⲟⲟⲩⲧⲥϩⲓⲙⲉ	
7505265	ⲡⲉϥ ⲣⲁⲛ ⲙⲙⲛⲧ ϩⲟⲟⲩⲧ ϣⲁ ⲩ ϫⲟⲟ ⲥ ⲉⲣⲟ ϥ ϫⲉ ⲡ ⲥⲱ ⲧⲏⲣ ⲡ ⲣⲉϥ ϫⲡⲉ ⲛ ⲕⲁ ⲛⲓⲙ ⲡⲉϥ ⲣⲁⲛ ⲙⲙⲛⲧⲥϩⲓⲙⲉ ϣⲁ ⲩ ϫⲟⲟ ⲥ ⲉⲣⲟ ϥ ϫⲉ ⲧ ⲥⲟⲫⲓⲁ ⲡⲁⲛⲅⲉⲛ ⲉⲧⲓⲣⲁ ϣⲁⲣⲉ ϩⲟⲉⲓⲛ ϫⲟⲟ ⲥ ⲉⲣⲟ ⲥ ϫⲉ ⲧ ⲡⲓⲥⲧⲓⲥ ⲡ ⲥⲱⲧⲏⲣ ϭⲉ ⲁ ϥ ⲥⲩⲙⲫⲱⲛⲉⲓ ⲙⲛ ⲧⲉϥ ⲥⲩⲛⲩⲅⲟⲥ ⲧ ⲡⲓⲥⲧⲓⲥ ⲥⲟⲫⲓⲁ ⲁ ϥ ⲟⲩⲱⲛϩ ⲛ ⲥⲟⲟⲩ ⲙ ⲡⲛⲉⲩⲙⲁ ⲧⲓⲕⲟⲛ ⲛϩⲟⲟⲩⲧ ⲥϩⲓⲙⲉ ⲉ ⲡⲧ ⲩ ⲡⲟⲥ ⲡⲉ ⲛ ⲛ ⲉⲧ ϩⲁⲧⲉⲩ ϩⲏ	
7505266	ⲛ ϩⲟⲟⲩⲧ ⲛⲉⲩ ⲣⲁⲛ ⲛⲉ ⲛⲁⲓ ⲡ ϣⲟⲣⲡ ⲡⲉ ⲡⲁ ⲅⲉⲛⲛⲏⲧⲟⲥ ⲡ ⲙⲉϩ ⲥⲛⲁⲩ ⲡⲉ ⲡ ⲁ ⲩ ⲧⲟⲅⲉⲛⲛⲏⲧⲟⲥ ⲡ ⲙⲉϩ ϣⲟⲙⲛⲧ ⲡⲉ ⲡⲅⲉⲛ ⲉⲧⲱⲣ	
7505267	ⲡ ⲙⲉϩ ϥⲧⲟⲟⲩ ⲡⲉ ⲡⲉⲡⲣⲱⲧⲟⲅⲉⲛ ⲉⲧⲱⲣ	
7505268	ⲡⲙⲉϩ ϯ ⲟⲩ ⲡⲉ ⲡⲁⲛⲅⲉⲛ ⲉⲧⲱⲣ	
7505269	ⲡⲙⲉϩⲥⲟⲟⲩ ⲡⲉ ⲡⲁⲣⲭⲓⲅⲉⲛ ⲉⲧⲱⲣ	
7505270	ⲛ ⲣⲁⲛ ϩⲱ ⲟⲩ ⲛ ⲛⲉ ϩⲓⲟⲙⲉ ⲛⲉ ⲛⲁⲓ	
7505271	ⲧ ϣⲟⲣⲡ ⲡⲉ ⲡ ⲡⲁⲛⲥⲟⲫⲟⲥ ⲥⲟⲫⲓⲁ	
7505272	ⲧⲙⲉϩⲥⲛⲧⲉ ⲡⲉ ⲡⲁⲛⲙⲏⲧⲱⲣ	
7505273	ⲥⲟⲫⲓⲁ	
7505274	ⲧⲙⲉϩϣⲟ ⲙ ⲧⲉ ⲡⲉ ⲡⲁⲛⲅⲉⲛ ⲉⲧⲓⲣⲁ ⲥⲟⲫⲓⲁ	
7505275	ⲧⲙⲉϩϥⲧⲟⲉ ⲡⲉ ⲧⲉⲡⲣⲱⲧⲟⲅⲉⲛ ⲉⲧⲓ ⲣ ⲁ ⲥⲟⲫⲓⲁ	
7505276	ⲧⲙⲉϩϯⲉ ⲧⲉ ⲧ ⲁⲅⲁⲡⲏ ⲥⲟ ⲫⲓⲁ	
7505277	ⲧⲙⲉϩⲥⲟⲉ ⲧⲉ ⲧ ⲡⲓⲥⲧⲓⲥ ⲥⲟ ⲫⲓⲁ	
7505278	ⲉⲃⲟⲗ ϩⲛ ⲧⲉⲩⲥⲩⲛⲫⲱⲛⲏ ⲥⲓ ⲥ ⲛⲧⲁⲉⲓⲣ ϣⲣⲡ	
7505279	ⲛ ϫⲟ ⲟⲩ ⲁⲩ ⲟⲩ ⲱⲛϩ ϩⲛ ⲛ ⲁⲓⲱⲛ ⲉⲧ ⲕⲏ ⲉϩⲣⲁⲓ ⲛϭⲓ ⲛⲉⲛⲛⲟⲓⲁ	
7505280	ⲉⲃⲟⲗ ϩⲛ ⲛ ⲉⲛⲛⲟⲓⲁ ⲛⲉⲛ ⲑⲩⲙⲏⲥⲓⲥ ⲉⲃⲟⲗ ϩⲛ ⲛ ⲉⲛⲑⲩⲙⲏⲥⲓⲥ ⲛⲉ ⲫⲣⲟⲛⲏⲥⲓⲥ ⲉⲃⲟⲗ ϩⲛ ⲛⲉⲫⲣⲟⲛⲏ ⲥⲓ ⲥ ⲛⲗⲟⲅⲓⲥⲙⲟⲥ	
7505281	ⲉⲃⲟⲗ ϩⲛ ⲛⲗⲟⲅⲓ ⲥⲙⲟⲥ ⲛⲉⲑⲉⲗⲏⲥⲓⲥ	
7505282	ⲉⲃⲟⲗ ϩⲛ ⲛⲉ ⲑⲉⲗⲏⲥⲓⲥ ⲛⲗⲟⲅⲟⲥ	
7505283	ⲧⲙⲛⲧⲥⲛⲟⲟⲩⲥ ϭⲉ ⲛ ϭⲟⲙ ⲛⲧⲁⲉⲓⲣ ϣⲣⲡ ⲛ ϫⲟⲟ ⲩ ⲁ ⲩ ⲥⲩⲙⲫⲱⲛⲉⲓ ⲙⲛ ⲛⲉ ⲩⲉⲣⲏⲟⲩ ⲁ ⲩ ⲟⲩⲱⲛϩ ⲉⲃⲟⲗ ⲛϭⲓ ⲛ ϩⲟⲟⲩⲧ ⲛⲉ ϩⲓⲟⲙⲉ 	
7505284	ϩⲱⲥⲧⲉ ⲛ ⲥ ⲉⲣ ϣϥⲉ ⲥⲛⲟⲟⲩⲥ ⲛⲇⲩⲛⲁⲙⲓⲥ	
7505285	ⲧⲉϣϥⲉⲥⲛⲟ ⲟⲩ ⲥ ⲁ ⲩ ⲟⲩⲱⲛϩ ⲉⲃⲟⲗ ⲛϭⲓ ⲧ ⲟⲩⲉⲓ ⲧⲟⲩ ⲉⲓ ⲙⲙⲟ ⲟⲩ ⲛ ϯⲟⲩ ⲙⲡ ⲛⲉⲩⲙⲁⲧⲓ ⲕ ⲟⲛ ⲉⲧⲉ ⲛⲁⲓ ⲛⲉ ⲧϣⲙⲧ ϣⲉⲥⲉ ⲛ ⲇⲩⲛⲁⲙⲓⲥ ⲡⲉⲩϩⲱⲧⲣ ⲧⲏⲣ ⲟⲩ ⲡⲉ ⲡ ⲟⲩⲱϣ	
7505286	ⲡⲁⲑⲁⲛⲁⲧⲟⲥ ϭⲉ ⲛ ⲣⲱⲙⲉ ⲁ ϥ ϣⲱⲡⲉ ⲛⲁ ϥ ⲛ ⲧⲩⲡⲟⲥ ⲛϭⲓ ⲡⲉⲛ ⲁ ⲓⲱⲛ	
7505287	ⲡⲉ ⲭⲣⲟⲛⲟⲥ ⲁ ϥ ϣⲱⲡⲉ ⲛ ⲧⲩⲡⲟⲥ ⲙⲡⲉⲡⲣⲱⲧⲟⲅⲉⲛ ⲉⲧⲱⲣ ⲡⲉϥ ϣⲏⲣⲉ	
7505288	ⲧⲉⲣⲟⲙⲡⲉ ⲁ ⲥ ϣⲱⲡⲉ ⲛ ⲧⲩⲡⲟⲥ ⲙⲡ ⲥⲱⲧⲏⲣ	
7505289	ⲡⲙⲛⲧⲥⲛⲟ ⲟⲩ ⲥ ⲛ ⲉⲃⲟⲧ ⲁ ⲩ ϣⲱⲡⲉ ⲛ ⲧⲩⲡⲟⲥ ⲛ ⲧ ⲙⲛⲧ ⲥⲛⲟⲟⲩⲥ ⲛϭⲟⲙ	
7505290	ⲡ ϣⲙⲧ ⲧϣⲉⲥⲉ ⲛⲧⲛ ⲧⲉⲣⲟⲙⲡⲉ ⲛ ϩⲟⲟⲩ ⲛ ⲧⲁⲩ ϣⲱⲡⲉ ⲛ ⲧⲩⲡⲟⲥ ⲛⲧ ϣⲙⲧ ϣⲉ ⲥⲉ ⲛϭⲟⲙ	
7505291	ⲛⲁⲓ ⲛ ⲧⲁ ⲩ ⲟⲩⲱⲛϩ ⲉⲃⲟⲗ ϩⲙ ⲡ ⲥⲱⲧⲏⲣ ⲛ ⲁⲅⲅⲉⲗⲟⲥ ⲛⲧ ⲁ ⲩ ϣⲱⲡⲉ ⲉⲃⲟⲗ ϩⲛ ⲛⲁⲓ ⲉⲧⲉ ⲙⲛ ⲏⲡⲉ ⲉⲣⲟ ⲟⲩ ⲁ ⲩ ϣⲱⲡⲉ ⲛⲁ ⲩ ⲛ ⲧⲩⲡⲟⲥ ⲛϭⲓ ⲛⲉ ⲩⲛⲟⲟⲩⲉ ⲙⲛ ⲛⲉ ⲩⲥⲟⲩⲥⲟⲩ ⲛⲧⲉⲣ ⲟⲩ ⲱⲛϩ ⲇⲉ ⲉⲃⲟⲗ ⲛϭⲓ ⲛⲉⲛ ⲧⲁ ⲉⲓ ϣⲁϫⲉ ⲉⲣⲟ ⲟⲩ ⲁ ϥ ⲧⲁⲙⲓⲟ ⲛⲁ ϥ ⲛϭⲓ ⲡⲁⲛⲅⲉⲛ ⲉⲧⲱⲣ ⲡⲉⲩ ⲉⲓⲱⲧ ⲛ ϣⲟⲣⲡ ⲙ ⲙⲛⲧ ⲥⲛⲟⲟⲩⲥ ⲛ ⲁⲓⲱⲛ ⲉϩⲟⲩⲛ ⲉ ⲧ ϩⲩⲡⲏⲣⲉⲥⲓⲁ ⲙⲛ ⲡⲙⲛ ⲧⲥⲛⲟⲟⲩⲥ ⲛⲁⲅⲅⲉⲗⲟⲥ	
7505292	ⲁⲩⲱ ⲛϩⲣⲁⲓ ϩⲛ ⲛ ⲁⲓⲱⲛ ⲧⲏⲣ ⲟⲩ ⲛⲉ ⲩ ⲛ ⲥⲟⲉ	
7505293	ⲥⲟⲉ	
7505294	ⲡⲉ	
7505295	ϩⲙ ⲡ ⲟⲩⲁ ⲡ ⲟⲩⲁ ⲙⲙⲟ ⲟⲩ ϩⲱⲥⲧⲉ ⲛ ⲥ ⲉⲣ ϣϥⲉ ⲥⲛⲟⲟⲩⲥ ⲙ ⲡⲉ ⲛ ⲧⲉ ⲧⲉ ϣ ϥⲉⲥⲛⲟⲟⲩⲉ ⲛ ϭⲟⲙ ⲛⲁⲓ ⲛ ⲧⲁ ⲩ ⲟⲩⲱⲛϩ ⲉⲃⲟⲗ ⲛϩⲏⲧϥ	
7505296	ⲁⲩⲱ ϩⲛ ⲙ ⲡⲏⲟⲩⲉ ⲧⲏⲣ ⲟⲩ ⲛⲉ ⲟⲩ ⲛ ϯⲟⲩ ϯⲟⲩ ⲛⲥⲧⲉ ⲣⲉⲱⲙⲁ ϩⲱⲥⲧⲉ ⲛ ⲥ ⲉⲣ ϣⲙⲧ ϣⲉ ⲥⲉ ⲛ ⲥⲧⲉⲣⲉⲱⲙⲁ ⲛⲧⲉ ⲧϣⲙⲧ ϣⲉ ⲥⲉ ⲛ ϭⲟⲙ ⲛⲁⲓ ⲛ ⲧⲁ ⲩ ⲟⲩⲱⲛϩ ⲉⲃⲟⲗ ⲛϩⲏⲧ ⲟⲩ ⲛⲉ ⲥⲧⲉⲣⲉⲱⲙⲁ ⲛⲧⲉ ⲣⲟⲩϫⲱⲕ ⲉⲃⲟⲗ ⲁ ⲩϯⲣⲛ ⲛⲁ ⲩ ϫⲉ ⲧϣⲙⲧ ϣⲉⲥⲉ ⲛ ⲡⲉ ⲉ ⲡ ⲣⲁⲛ ⲛⲙ ⲡⲏⲟⲩⲉ ⲉⲧ ϩⲁⲧⲉⲩ ϩⲏ	
7505297	ⲁⲩⲱ ⲛⲁⲓ ⲧⲏ ⲣ ⲟⲩ ⲥⲉ ϫⲏⲕ ⲁⲩⲱ ⲛ ⲁⲛ ⲟⲩ ⲁⲩⲱ ⲛⲧⲉ ⲉ ⲓ ϩⲉ ⲁ ϥ ⲟⲩⲱⲛϩ ⲉⲃⲟⲗ ⲛϭⲓ ⲡϩⲩⲥⲧⲉ ⲣⲏ ⲙⲁ ⲛⲧ ⲙⲛⲧ ⲥϩⲓⲙⲉ	
7505298	ⲡⲉϩⲟⲩⲉⲓⲧ ϭⲉ ⲛ ⲁⲓⲱⲛ ⲡⲁ ⲡ ⲁⲑⲁⲛⲁⲧⲟⲥ ⲛ ⲣⲱⲙⲉ ⲡⲉ ⲡ ⲙⲉϩ ⲥⲛⲁⲩ ⲛ ⲁⲓⲱⲛ ⲡⲁ ⲡ ϣⲏⲣⲉ ⲙ ⲡ ⲣⲱⲙⲉ ⲡⲉ ⲡ ⲉⲧⲉ ϣⲁ ⲩ ϫⲟⲟ ⲥ ⲉ ⲣⲟ ϥ ϫⲉ ⲡⲉⲡⲣⲱⲧⲟⲅⲉⲛ ⲉⲧⲱⲣ ⲡ ⲉ ⲧⲉ ϣⲁ ⲩ ⲙⲟⲩⲧⲉ ⲉⲣⲟ ϥ ϫⲉ ⲡ ⲥⲱⲧⲏⲣ ⲡ ⲉⲧⲉⲙⲁϩⲧⲉ ⲛ ⲛⲁⲓ ⲡ ⲁⲓⲱⲛ ⲡ ⲉ ⲧⲉ ⲙⲛ ⲙⲛ ⲧ ⲣⲣⲟ ϩⲓϫⲱ ϥ ⲛⲧⲛ ⲡ ϣⲁ ⲉⲛⲉϩ ⲛ ⲛⲟⲩⲧⲉ ⲛ ⲁⲡⲉⲣⲁⲛⲧⲟⲥ ⲡⲁⲓ ⲱ ⲛ ⲛⲧⲉ ⲛⲓ ⲁⲓⲱⲛ ⲛⲧⲛ ⲛ ⲁⲑⲁⲛⲁⲧⲟⲥ ⲉⲧ ⲛ ϩⲏⲧϥ	
7505299	ⲡⲥⲁⲛϩⲣⲉ ⲛⲧⲙⲉϩϣ ⲙⲟⲩ ⲛⲉ ⲛⲧⲁ ϩⲟⲩⲱⲛϩ ⲉⲃⲟⲗ ϩⲙ ⲡ ⲭⲁⲟⲥ ⲛⲧⲟϥ ⲇⲉ ⲡ ⲁⲑⲁⲛⲁⲧⲟⲥ ⲛ ⲣⲱ ⲙⲉ ⲁ ϥ ⲟⲩⲱⲛϩ ⲉⲃⲟⲗ ⲛϩⲛⲁⲓⲱⲛ ⲙⲛ ϩⲛ ϭⲟⲙ ⲙⲛ ϩⲉⲛ ⲙⲛⲧ ⲣⲣⲟ ⲁ ϥ ϯ ⲛⲧⲉⲯⲟⲩⲥⲓⲁ ⲛ ⲟⲩⲟⲛ ⲛⲓⲙ	
7505300	ⲛⲧⲁⲩ ⲟⲩⲱⲛϩ ⲉⲃⲟⲗ ⲛϩⲏⲧϥ	
7505301	ⲉ ⲧⲣⲟⲩⲧⲁⲛⲟ ⲛ ⲛⲁⲓ ⲉⲧ ⲟⲩⲁϣⲟⲩ ϣⲁ ⲛⲉ ϩⲟⲟⲩ ⲉⲧⲙⲡⲥⲁϩⲣⲉ ⲙⲡⲉⲭⲁ ⲟ ⲥ ⲛⲁⲓ ⲅⲁⲣ ⲁ ⲩⲥⲩⲙⲫⲱⲛⲓ ⲙⲛ ⲛⲉⲩ ⲉ ⲣⲏⲟⲩ ⲁ ⲩ ⲟⲩⲱⲛϩ ⲉⲃⲟⲗ ⲙⲙⲛⲧ ⲛⲟϭ ⲛⲓⲙ	
7505302	ⲁⲩⲱ ⲉⲃⲟⲗ ϩⲛ ⲟⲩⲡ ⲛⲁ ⲛ ⲟⲩ ⲙⲏⲏϣⲉ ⲛ ⲟⲩⲟⲉⲓⲛ ⲉ ⲩ ϩⲁ ⲉ ⲟⲟⲩ ⲉ ⲙⲛⲧ ⲟⲩ ⲏⲡⲉ ⲛⲁⲓ ⲛ ⲧⲁ ⲩ ϯ ⲣⲓ ⲛⲟⲩ ⲛ ⲧ ⲁⲣⲭⲏ ⲉⲧⲉ ⲡⲉ ⲉⲓ ⲡⲉ ⲧⲉ ϩⲟⲩⲉⲓⲧⲉ ⲧ ⲙⲏⲧⲉ ⲙⲛ ⲡ ϫⲱⲕ ⲉⲃⲟⲗ ⲉⲧⲉ ⲡⲁⲓ ⲡⲉ ⲡⲉϩⲟⲩⲉⲓⲧ ⲛⲁⲓ ⲱ ⲛ ⲙⲛ ⲡ ⲙⲉϩ ⲥⲛⲁⲩ ⲙⲛ ⲡ ⲙⲉϩ ϣⲟⲙⲛⲧ ⲡⲉϩⲟⲩⲉⲓⲧ ⲁ ⲩ ϯ ⲣⲛ ϥ ϫⲉ ⲧⲙⲛⲧ ⲟⲩⲁ ⲁⲩⲱ ⲧ ⲁⲛⲁⲡⲁⲩⲥⲓⲥ ⲉ ⲩ ⲛⲧⲉ ⲡ ⲟⲩⲁ ⲡ ⲟⲩⲁ ⲙⲙⲁⲩ ⲡⲉϥ ⲣⲁⲛ ϫⲉ ⲁ ⲩⲟⲛⲟⲙⲁⲉ ⲛⲧⲉⲕⲕⲗⲏ ⲥ ⲓⲁ ϩⲙ ⲡ ⲙⲉϩ ϣⲟⲙⲛⲧ ⲛ ⲁⲓⲱⲛ ϫⲉ ⲉ ⲃⲟⲗ ϩⲙ ⲡⲓⲁⲧⲟ ⲛ ⲙⲏⲏϣⲉ ⲛ ⲧⲁ ϩⲟⲩⲱⲛϩ ⲉⲃⲟⲗ ϩⲙ ⲡⲓ ⲟⲩⲁ ⲛ ⲟⲩ ⲁ ⲧⲟ ⲉⲧⲃⲉ ⲡⲁⲓ ⲉⲣⲉ ⲡⲓ ⲙⲏⲏϣⲉ ⲥⲱⲟⲩϩ ⲛ ⲥⲉ ⲉⲓ ⲉ ⲩⲙⲛⲧⲟⲩⲁ	
7505303	ϣ ⲁ ⲩ ⲙⲟⲩⲧⲉ ⲉⲣⲟ ⲟⲩ ϫⲉ ⲉ ⲕⲕⲗⲏ ⲥ ⲓⲁ ⲉⲃⲟⲗ ϩⲛ ϯ ⲉⲕⲕⲗⲏⲥⲓⲁ ⲉ ⲧ ⲟⲩⲁⲧⲃ	
7505304	ⲉ ⲧ ⲡⲉ ⲉⲧⲃⲉ ⲡⲉ ⲉ ⲓ ⲧ ⲉⲕⲕⲗⲏⲥⲓⲁ ⲛ ⲧⲙⲉϩϣⲙⲟⲩⲛⲉ	
7505305	ⲁⲩⲟⲩⲟⲛϩⲥ ⲉⲃⲟⲗ ⲉ ⲩϩⲁⲟⲩⲧⲥϩⲓⲙⲉ	
7505306	ⲁⲩ ϯ ⲣⲁⲛ ⲉⲣⲟ ⲥ ⲉⲕ ⲙⲉⲣⲟⲥ ⲛ ϩⲟⲟⲩⲧ ⲁⲩⲱ ⲉⲕ ⲙⲉⲣⲟⲥ ⲛⲥϩⲓⲙⲉ	
7505307	ⲡ ϩⲟⲟⲩⲧ ⲁ ⲩ ϯ ⲣⲛ ϥ ϫⲉ ⲉⲕ ⲕⲗⲏⲥⲓⲁ ⲧⲉ ⲥϩⲓⲙⲉ ϫⲉ ⲱ ⲏ ϫⲉ ⲕⲁⲁ ⲥ ⲉ ⲥ ⲛⲁ ⲟⲩ ⲱⲛϩ ⲉⲃⲟⲗ ϫⲉ ⲉⲃⲟⲗ ϩⲛ ⲟⲩ ⲥϩⲓⲙⲉ ⲁ ⲡ ⲱⲛϩ ϣⲱⲡⲉ	
7505308	ϩⲛ ⲛ ⲁⲓⲱⲛ ⲧⲏⲣⲟⲩ	
7505309	ⲣⲁⲛ ⲛⲓⲙ ⲉ ⲁ ⲩ ϫⲓ ⲧⲟⲩ ϫⲓⲛ ⲛ ⲧ ⲁⲣⲭⲏ ⲉⲃⲟⲗ ϩⲙ ⲡⲉϥ ⲙ ⲉ ⲧⲉ ⲙⲛ ⲧⲉϥ ⲉⲛⲛⲟⲓⲁ ⲁ ⲩ ⲟⲩⲱⲛϩ ⲛϭⲓ ⲛ ⲇⲩⲛⲁⲙⲓⲥ ⲛⲁⲓ ⲛⲧ ⲁ ⲩ ϯ ⲣ ⲓ ⲛ ⲟⲩ ϫⲉ ⲛⲛⲟⲩⲧⲉ	
7505310	ⲛ ⲛⲟⲩⲧⲉ ⲇⲉ ⲉⲃⲟⲗ ϩⲛ ⲛⲉⲩ ⲫⲣⲟⲛⲏⲥⲓⲥ ⲁⲩ ⲟⲩ ⲱⲛϩ ⲉⲃⲟⲗ ⲛϩⲛ ⲛⲟⲩⲧⲉ ⲛ ⲛ ⲟⲩ ⲧⲉ	
7505311	ⲛ ⲛⲟⲩⲧⲉ ⲇⲉ ⲉⲃⲟⲗ ϩⲛ ⲛⲉⲩ ⲫⲣⲟⲛⲏⲥⲓⲥ ⲁ ⲩ ⲟⲩⲱⲛϩ ⲛϩⲛ ϫⲟ ⲉⲓⲥ	
